{
  "artifact_type": "blinding_key",
  "schema_version": "1.0.0",
  "packet_id": "development-pilot-claude-001",
  "created_at": "2026-10-05T11:53:37.880889Z",
  "seed_hash": "ce5ba6b58a11204c403689c095b0cf49cce8f498bb57d8b21970ef470b2397c5",
  "items": [
    {
      "item_id": "item-590d10f6ae40581007e332ee",
      "scenario_id": "hard-negative-003",
      "template_family": "hard-negative",
      "query_id": "query-001",
      "repeat": 2,
      "condition": "B0",
      "memory_needed": false,
      "relevant_memory_ids": [],
      "forbidden_memory_ids": [
        "92000000-0000-4000-8000-000000000003"
      ],
      "provider": "claude-cli",
      "model": "haiku",
      "provider_model": "claude-haiku-4-5"
    },
    {
      "item_id": "item-9b23f1bcb4f4f2b9dbedbdfc",
      "scenario_id": "hard-negative-003",
      "template_family": "hard-negative",
      "query_id": "query-001",
      "repeat": 2,
      "condition": "B3",
      "memory_needed": false,
      "relevant_memory_ids": [],
      "forbidden_memory_ids": [
        "92000000-0000-4000-8000-000000000003"
      ],
      "provider": "claude-cli",
      "model": "haiku",
      "provider_model": "claude-haiku-4-5"
    },
    {
      "item_id": "item-112844a31f9c6345be48041f",
      "scenario_id": "project-exception-003",
      "template_family": "project-exception",
      "query_id": "query-001",
      "repeat": 1,
      "condition": "B1",
      "memory_needed": true,
      "relevant_memory_ids": [
        "52000000-0000-4000-8000-000000000006"
      ],
      "forbidden_memory_ids": [],
      "provider": "claude-cli",
      "model": "haiku",
      "provider_model": "claude-haiku-4-5"
    },
    {
      "item_id": "item-b6a35c288c4a54aac2e73a45",
      "scenario_id": "project-exception-004",
      "template_family": "project-exception",
      "query_id": "query-001",
      "repeat": 1,
      "condition": "B2",
      "memory_needed": true,
      "relevant_memory_ids": [
        "52000000-0000-4000-8000-000000000008"
      ],
      "forbidden_memory_ids": [],
      "provider": "claude-cli",
      "model": "haiku",
      "provider_model": "claude-haiku-4-5"
    },
    {
      "item_id": "item-05323d2412f98947d67135e6",
      "scenario_id": "project-exception-003",
      "template_family": "project-exception",
      "query_id": "query-001",
      "repeat": 2,
      "condition": "B1",
      "memory_needed": true,
      "relevant_memory_ids": [
        "52000000-0000-4000-8000-000000000006"
      ],
      "forbidden_memory_ids": [],
      "provider": "claude-cli",
      "model": "haiku",
      "provider_model": "claude-haiku-4-5"
    },
    {
      "item_id": "item-763d2695d96356f818578333",
      "scenario_id": "global-preference-003",
      "template_family": "global-preference",
      "query_id": "query-001",
      "repeat": 2,
      "condition": "B1",
      "memory_needed": true,
      "relevant_memory_ids": [
        "42000000-0000-4000-8000-000000000003"
      ],
      "forbidden_memory_ids": [],
      "provider": "claude-cli",
      "model": "haiku",
      "provider_model": "claude-haiku-4-5"
    },
    {
      "item_id": "item-7fe59006862614da6ebd2939",
      "scenario_id": "project-exception-003",
      "template_family": "project-exception",
      "query_id": "query-001",
      "repeat": 1,
      "condition": "B2",
      "memory_needed": true,
      "relevant_memory_ids": [
        "52000000-0000-4000-8000-000000000006"
      ],
      "forbidden_memory_ids": [],
      "provider": "claude-cli",
      "model": "haiku",
      "provider_model": "claude-haiku-4-5"
    },
    {
      "item_id": "item-614abe063fe6e978000f193a",
      "scenario_id": "project-exception-002",
      "template_family": "project-exception",
      "query_id": "query-001",
      "repeat": 1,
      "condition": "B1",
      "memory_needed": true,
      "relevant_memory_ids": [
        "52000000-0000-4000-8000-000000000004"
      ],
      "forbidden_memory_ids": [],
      "provider": "claude-cli",
      "model": "haiku",
      "provider_model": "claude-haiku-4-5"
    },
    {
      "item_id": "item-6a3fb6780db174ebd85792c9",
      "scenario_id": "deletion-001",
      "template_family": "deletion",
      "query_id": "query-001",
      "repeat": 2,
      "condition": "B2",
      "memory_needed": false,
      "relevant_memory_ids": [],
      "forbidden_memory_ids": [
        "82000000-0000-4000-8000-000000000001"
      ],
      "provider": "claude-cli",
      "model": "haiku",
      "provider_model": "claude-haiku-4-5"
    },
    {
      "item_id": "item-b1bd9479bc82bfa0e67f17d4",
      "scenario_id": "preference-change-002",
      "template_family": "preference-change",
      "query_id": "query-001",
      "repeat": 2,
      "condition": "B2",
      "memory_needed": true,
      "relevant_memory_ids": [
        "72000000-0000-4000-8000-000000000002"
      ],
      "forbidden_memory_ids": [],
      "provider": "claude-cli",
      "model": "haiku",
      "provider_model": "claude-haiku-4-5"
    },
    {
      "item_id": "item-91568a992b04d968e8e3abc4",
      "scenario_id": "deletion-002",
      "template_family": "deletion",
      "query_id": "query-001",
      "repeat": 1,
      "condition": "B1",
      "memory_needed": false,
      "relevant_memory_ids": [],
      "forbidden_memory_ids": [
        "82000000-0000-4000-8000-000000000002"
      ],
      "provider": "claude-cli",
      "model": "haiku",
      "provider_model": "claude-haiku-4-5"
    },
    {
      "item_id": "item-1fc14372a715ebf6f1907333",
      "scenario_id": "global-preference-001",
      "template_family": "global-preference",
      "query_id": "query-001",
      "repeat": 1,
      "condition": "B0",
      "memory_needed": true,
      "relevant_memory_ids": [
        "42000000-0000-4000-8000-000000000001"
      ],
      "forbidden_memory_ids": [],
      "provider": "claude-cli",
      "model": "haiku",
      "provider_model": "claude-haiku-4-5"
    },
    {
      "item_id": "item-e73af01eb842416288062992",
      "scenario_id": "deletion-003",
      "template_family": "deletion",
      "query_id": "query-001",
      "repeat": 2,
      "condition": "B1",
      "memory_needed": false,
      "relevant_memory_ids": [],
      "forbidden_memory_ids": [
        "82000000-0000-4000-8000-000000000003"
      ],
      "provider": "claude-cli",
      "model": "haiku",
      "provider_model": "claude-haiku-4-5"
    },
    {
      "item_id": "item-f26c16661a50bb3f2c516795",
      "scenario_id": "global-preference-001",
      "template_family": "global-preference",
      "query_id": "query-001",
      "repeat": 1,
      "condition": "B1",
      "memory_needed": true,
      "relevant_memory_ids": [
        "42000000-0000-4000-8000-000000000001"
      ],
      "forbidden_memory_ids": [],
      "provider": "claude-cli",
      "model": "haiku",
      "provider_model": "claude-haiku-4-5"
    },
    {
      "item_id": "item-804e79c8a449a1e0839ed0b9",
      "scenario_id": "project-exception-004",
      "template_family": "project-exception",
      "query_id": "query-001",
      "repeat": 1,
      "condition": "B0",
      "memory_needed": true,
      "relevant_memory_ids": [
        "52000000-0000-4000-8000-000000000008"
      ],
      "forbidden_memory_ids": [],
      "provider": "claude-cli",
      "model": "haiku",
      "provider_model": "claude-haiku-4-5"
    },
    {
      "item_id": "item-09419b8d7501c44d146277d4",
      "scenario_id": "global-preference-004",
      "template_family": "global-preference",
      "query_id": "query-001",
      "repeat": 1,
      "condition": "B3",
      "memory_needed": true,
      "relevant_memory_ids": [
        "42000000-0000-4000-8000-000000000004"
      ],
      "forbidden_memory_ids": [],
      "provider": "claude-cli",
      "model": "haiku",
      "provider_model": "claude-haiku-4-5"
    },
    {
      "item_id": "item-b502fb9076cd66adf839b6a2",
      "scenario_id": "global-preference-004",
      "template_family": "global-preference",
      "query_id": "query-001",
      "repeat": 1,
      "condition": "B1",
      "memory_needed": true,
      "relevant_memory_ids": [
        "42000000-0000-4000-8000-000000000004"
      ],
      "forbidden_memory_ids": [],
      "provider": "claude-cli",
      "model": "haiku",
      "provider_model": "claude-haiku-4-5"
    },
    {
      "item_id": "item-d1fea9b8ae63f1565d061f8b",
      "scenario_id": "direct-correction-002",
      "template_family": "direct-correction",
      "query_id": "query-001",
      "repeat": 1,
      "condition": "B3",
      "memory_needed": true,
      "relevant_memory_ids": [
        "62000000-0000-4000-8000-000000000002"
      ],
      "forbidden_memory_ids": [],
      "provider": "claude-cli",
      "model": "haiku",
      "provider_model": "claude-haiku-4-5"
    },
    {
      "item_id": "item-9eadd557d1635263ab0fc5af",
      "scenario_id": "preference-change-004",
      "template_family": "preference-change",
      "query_id": "query-001",
      "repeat": 1,
      "condition": "B0",
      "memory_needed": true,
      "relevant_memory_ids": [
        "72000000-0000-4000-8000-000000000004"
      ],
      "forbidden_memory_ids": [],
      "provider": "claude-cli",
      "model": "haiku",
      "provider_model": "claude-haiku-4-5"
    },
    {
      "item_id": "item-c3376c938f3f69a3b9592300",
      "scenario_id": "deletion-001",
      "template_family": "deletion",
      "query_id": "query-001",
      "repeat": 2,
      "condition": "B3",
      "memory_needed": false,
      "relevant_memory_ids": [],
      "forbidden_memory_ids": [
        "82000000-0000-4000-8000-000000000001"
      ],
      "provider": "claude-cli",
      "model": "haiku",
      "provider_model": "claude-haiku-4-5"
    },
    {
      "item_id": "item-659119d81f33ab7c4ce49397",
      "scenario_id": "hard-negative-001",
      "template_family": "hard-negative",
      "query_id": "query-001",
      "repeat": 1,
      "condition": "B1",
      "memory_needed": false,